{
  "contractVersion": 1,
  "correlation": { "requestId": "request-1", "userId": "user-1", "sessionId": "session-1" },
  "toolCallId": "call-1",
  "toolName": "browser.invoke_discovered_api",
  "arguments": {
    "siteId": "local-fixture",
    "operationId": "1234567890abcdef12345678",
    "parameters": { "q": "headphones" }
  }
}
